{
  "id": "wsgf",
  "slug": "wsgf",
  "name": "WSGF 宽屏游戏论坛",
  "aliases": [
    "Widescreen Gaming Forum"
  ],
  "category": "patch-support",
  "url": "https://www.wsgf.org/",
  "languages": [
    "en"
  ],
  "feeNote": "免费",
  "summary": "带鱼屏（21:9 / 32:9）与多屏玩家的数据库：哪些游戏原生支持宽屏、黑边与拉伸怎么修、FOV 怎么调。",
  "purposes": [
    "宽屏支持查询",
    "黑边与 FOV 修复",
    "多显示器设置"
  ],
  "sources": [
    {
      "name": "WSGF 宽屏游戏论坛",
      "url": "https://www.wsgf.org/"
    }
  ],
  "linkHealth": "ok",
  "reviewStatus": "verified",
  "checkedAt": "2026-10-30",
  "createdAt": "2026-10-30",
  "updatedAt": "2026-10-30",
  "publishStatus": "published"
}
